{
  "schema_version": "ai-evidence-v1",
  "artifact_type": "readiness",
  "target": "internal",
  "branch": "NOT_RUN",
  "commit_sha": "0000000000000000000000000000000000000000",
  "dirty": true,
  "environment": "testing",
  "generated_at": "1970-01-01T00:00:00Z",
  "policy_version": "NOT_RUN",
  "provider": "NOT_RUN",
  "model": null,
  "schema_versions": {
    "evidence": "ai-evidence-v1",
    "command_result": "ai-command-result-v1"
  },
  "commands": [],
  "exit_codes": {},
  "input_artifact_hashes": {},
  "output_artifact_hashes": {},
  "reviewer": {
    "name": "NOT_RUN",
    "role": "independent-evidence-reviewer",
    "status": "NOT_RUN"
  },
  "gates": {
    "G0": {"status": "NOT_RUN", "command_ids": []},
    "G1": {"status": "NOT_RUN", "command_ids": []},
    "G2": {"status": "NOT_RUN", "command_ids": []},
    "G3": {"status": "NOT_RUN", "command_ids": []},
    "G4": {"status": "NOT_RUN", "command_ids": []},
    "G5": {"status": "NOT_RUN", "command_ids": []},
    "G6": {"status": "NOT_RUN", "command_ids": []},
    "G7": {"status": "NOT_RUN", "command_ids": []}
  },
  "blockers": ["NOT_RUN: replace this template only after real command capture"],
  "result": "NOT_RUN",
  "release_gate": "disabled-until-approved",
  "details": {
    "template": true,
    "instructions": "This file is a schema-shaped template, not release evidence."
  }
}
