{
  "schema_version": "ai-evidence-v1",
  "artifact_type": "stability",
  "target": "internal",
  "branch": "NOT_RUN",
  "commit_sha": "0000000000000000000000000000000000000000",
  "dirty": true,
  "environment": "testing",
  "generated_at": "1970-01-01T00:00:00Z",
  "policy_version": "NOT_RUN",
  "provider": "NOT_RUN",
  "model": null,
  "schema_versions": {"evidence": "ai-evidence-v1"},
  "commands": [],
  "exit_codes": {},
  "input_artifact_hashes": {},
  "output_artifact_hashes": {},
  "reviewer": {
    "name": "NOT_RUN",
    "role": "stability-reviewer",
    "status": "NOT_RUN"
  },
  "gates": {
    "G0": {"status": "NOT_RUN", "command_ids": []},
    "G1": {"status": "NOT_RUN", "command_ids": []},
    "G2": {"status": "NOT_RUN", "command_ids": []},
    "G3": {"status": "NOT_RUN", "command_ids": []},
    "G4": {"status": "NOT_RUN", "command_ids": []},
    "G5": {"status": "NOT_RUN", "command_ids": []},
    "G6": {"status": "NOT_RUN", "command_ids": []},
    "G7": {"status": "NOT_RUN", "command_ids": []}
  },
  "blockers": ["NOT_RUN: 3-5 day observation has not been executed"],
  "result": "NOT_RUN",
  "release_gate": "disabled-until-approved",
  "details": {
    "template": true,
    "stability": {
      "observation_started_at": null,
      "observation_ended_at": null,
      "duration_hours": 0,
      "metrics": {
        "worker_restarts": null,
        "claim_latency_p95_ms": null,
        "retry_rate_pct": null,
        "dead_letter_count": null,
        "consent_denials": null,
        "deletion_p95_seconds": null,
        "outbox_backlog_max": null,
        "purge_backlog_max": null,
        "provider_errors": null,
        "sensitive_log_hits": null
      },
      "incidents": []
    }
  }
}
